{
  "trackId": "boss_conductor_p3",
  "bpm": 105,
  "meterSequence": [
    { "startBar": 1, "bars": 4, "num": 5, "den": 4 },
    { "startBar": 5, "bars": 4, "num": 7, "den": 8 },
    { "startBar": 9, "bars": 4, "num": 4, "den": 4 },
    { "startBar": 13, "bars": 4, "num": 3, "den": 4 }
  ],
  "subdivision": 16,
  "events": [
    { "bar": 1, "step": 0, "type": "downbeat" },
    { "bar": 2, "step": 0, "type": "downbeat" },
    { "bar": 3, "step": 0, "type": "downbeat" },
    { "bar": 3, "step": 8, "type": "enemyTelegraph", "payload": "discord_wave" },
    { "bar": 4, "step": 0, "type": "downbeat" },
    { "bar": 5, "step": 0, "type": "downbeat" },
    { "bar": 5, "step": 0, "type": "phaseTransition", "payload": "meter_shift" },
    { "bar": 6, "step": 0, "type": "downbeat" },
    { "bar": 7, "step": 0, "type": "downbeat" },
    { "bar": 7, "step": 8, "type": "enemyTelegraph", "payload": "baton_sweep" },
    { "bar": 8, "step": 0, "type": "downbeat" },
    { "bar": 9, "step": 0, "type": "downbeat" },
    { "bar": 9, "step": 0, "type": "phaseTransition", "payload": "meter_shift" },
    { "bar": 10, "step": 0, "type": "downbeat" },
    { "bar": 11, "step": 0, "type": "downbeat" },
    { "bar": 11, "step": 8, "type": "enemyTelegraph", "payload": "tempo_surge" },
    { "bar": 12, "step": 0, "type": "downbeat" },
    { "bar": 13, "step": 0, "type": "downbeat" },
    { "bar": 13, "step": 0, "type": "phaseTransition", "payload": "meter_shift" },
    { "bar": 14, "step": 0, "type": "downbeat" },
    { "bar": 15, "step": 0, "type": "downbeat" },
    { "bar": 15, "step": 8, "type": "enemyTelegraph", "payload": "discord_wave" },
    { "bar": 16, "step": 0, "type": "downbeat" }
  ]
}
