{
  "trackId": "mid_biome_1_01",
  "bpm": 117,
  "meterSequence": [
    { "startBar": 1, "bars": 4, "num": 3, "den": 4 },
    { "startBar": 5, "bars": 4, "num": 6, "den": 8 }
  ],
  "subdivision": 16,
  "events": [
    { "bar": 1, "step": 0, "type": "downbeat" },
    { "bar": 2, "step": 0, "type": "downbeat" },
    { "bar": 3, "step": 0, "type": "downbeat" },
    { "bar": 3, "step": 8, "type": "enemyTelegraph", "payload": "drifter_sway" },
    { "bar": 4, "step": 0, "type": "downbeat" },
    { "bar": 5, "step": 0, "type": "downbeat" },
    { "bar": 6, "step": 0, "type": "downbeat" },
    { "bar": 7, "step": 0, "type": "downbeat" },
    { "bar": 7, "step": 8, "type": "enemyTelegraph", "payload": "drifter_drag" },
    { "bar": 8, "step": 0, "type": "downbeat" }
  ]
}
