{
  "trackId": "boss_lunal_p1",
  "bpm": 105,
  "meterSequence": [{ "startBar": 1, "bars": 8, "num": 4, "den": 4 }],
  "subdivision": 16,
  "events": [
    { "bar": 1, "step": 0, "type": "downbeat" },
    { "bar": 2, "step": 0, "type": "downbeat" },
    { "bar": 2, "step": 10, "type": "enemyTelegraph", "payload": "hush_the_room" },
    { "bar": 3, "step": 0, "type": "downbeat" },
    { "bar": 4, "step": 0, "type": "downbeat" },
    { "bar": 4, "step": 14, "type": "syncopationAccent", "payload": "deceptive" },
    { "bar": 5, "step": 0, "type": "downbeat" },
    { "bar": 6, "step": 0, "type": "downbeat" },
    { "bar": 6, "step": 10, "type": "enemyTelegraph", "payload": "straighten_his_collar" },
    { "bar": 7, "step": 0, "type": "downbeat" },
    { "bar": 8, "step": 0, "type": "downbeat" },
    { "bar": 8, "step": 14, "type": "syncopationAccent", "payload": "deceptive" }
  ]
}
