{
  "trackId": "opening_biome_01",
  "bpm": 105,
  "meterSequence": [{ "startBar": 1, "bars": 8, "num": 4, "den": 4 }],
  "subdivision": 16,
  "events": [
    { "bar": 1, "step": 0, "type": "downbeat" },
    { "bar": 2, "step": 0, "type": "downbeat" },
    { "bar": 3, "step": 0, "type": "downbeat" },
    { "bar": 3, "step": 8, "type": "enemyTelegraph", "payload": "slime_lunge" },
    { "bar": 4, "step": 0, "type": "downbeat" },
    { "bar": 5, "step": 0, "type": "downbeat" },
    { "bar": 6, "step": 0, "type": "downbeat" },
    { "bar": 7, "step": 0, "type": "downbeat" },
    { "bar": 7, "step": 8, "type": "enemyTelegraph", "payload": "slime_lunge" },
    { "bar": 8, "step": 0, "type": "downbeat" }
  ]
}
